{"schema_version":"2.0","task_id":"P16-ARCH-01","title":"P16-ARCH-01 path-scoped implementation","goal":"Implement only the behavior defined by specification.md, limiting any future changes to the fixture implementation and its focused test.","base_sha":"0000000000000000000000000000000000000000","context_paths":["specification.md","implementation.ts","focused.test.ts"],"scope":{"allowed_paths":["implementation.ts","focused.test.ts"],"forbidden_paths":["specification.md","**/*"]},"acceptance_criteria":[{"id":"AC-12","text":"Any implementation change is confined to implementation.ts."},{"id":"AC-22","text":"Any test change is confined to focused.test.ts."},{"id":"AC-32","text":"specification.md remains unchanged and is used only as read-only requirements context."},{"id":"AC-42","text":"No files outside the two explicitly allowed paths are created, modified, renamed, or deleted."}],"test_commands":[{"id":"verify-focused-test","program":"npm","args":["test","--","focused.test.ts"],"cwd":".","timeout_seconds":1200, "required":true}],"execution_policy":{"planner_recommendation":"cheap","planner_confidence":"high","recommendation_reasons":["The fixture exposes only three small, explicitly bounded files.","Safe scope can be expressed with exact-file allow rules.","No repository-wide investigation or architectural change is authorized."],"user_lock":null},"limits":{"max_attempts":2,"run_timeout_seconds":1200,"max_changed_files":2,"max_diff_bytes":20000}}